objectid,title,project_link,description,subject,date,creator,institution,location,latitude,longitude,language,creator_github,cb_template,collection_type,institution_type,home_feature,format,display_template,object_location,image_small,image_thumb
example0033,Environmental Justice Research Repository,https://learn-static.github.io/eng-470/,"This digital collection was created in partnership between the University of Oregon's ENG 470 Technologies & Texts Capstone course and the UO Libraries DREAM Lab, and in consultation with Beyond Toxics, a nonprofit organization working for environmental justice in Oregon. It serves as a repository of research materials related to the history of environmental racism in the Eugene-Springfield community.",Environmental justice; Racism; Environmental activism; Urban ecology,2022,Kate Thornhill; Mattie Burkert,University of Oregon,"Eugene, OR",44.11396139,-123.059202,eng,https://github.com/kmthorn,CB-GH,Course; Student Project,,,image/jpeg,project,/objects/example0033.jpg,/objects/small/example0033_sm.jpg,"/objects/thumbs/example0033_th.jpg"
example0034,Victorian Visual Culture,https://jkcronin.github.io/VictorianVisualCulture/,An exhibition on Victorian Visual Culture. Curated and created by students in VISA 2P90 at Brock University.,Victorian era; Victorian art; Victorian culture,2021,J. Keri Cronin,Brock University,"St. Catharines, Ontario, Canada",43.41983876,-79.25063695,eng,https://github.com/jkcronin,CB-GH,Student Project,,,image/jpeg,project,/objects/example0034.jpg,/objects/small/example0034_sm.jpg,"/objects/thumbs/example0034_th.jpg"
example0035,Local Gems from the Farmington Room,https://farmingtonlibraries.github.io/farmingtonroom/,"A collection of images of select items held in the Farmington Libraries' local history room, called the Farmington Room",Local history; Scrapbooks,2021,FarmingtonLibraries,Farmington Libraries,"Farmington, CT",41.74996107,-72.86789761,eng,https://github.com/FarmingtonLibraries,CB-GH,Digital Archive,Public Library,,image/jpeg,project,/objects/example0035.jpg,/objects/small/example0035_sm.jpg,"/objects/thumbs/example0035_th.jpg"
example0036,Mathematicians of the 20th Century,https://paulrondario26.github.io/math10rondario/,"The purpose of this website is to display biographical entries of influential mathematicians born in the first half of the 20th century. It provides short descriptions for the contributions of the mathematicians, their birthplaces, their birthdates, and images for identification. The website is created for educational purposes, for the class of Sir Daryl Saddi, Math 10.",Mathematicians; Biographies,2023,Eugeryl Paul Rondario,University of the Philippines,"Quezon City, Philippines",14.65375649,121.0683183,eng,https://github.com/paulrondario26,CB-GH,Student Project,,,image/jpeg,project,/objects/example0036.jpg,/objects/small/example0036_sm.jpg,"/objects/thumbs/example0036_th.jpg"
example0037,Mapping Makerspaces,https://lis9704.github.io/,"This project maps makerspaces in public libraries in southern Ontario. Browse the map and corresponding word clouds to find makerspaces of all sorts, the tools, equipment and spaces available, their branch locations, and more. Under Resources, find readings, programs, and project ideas to put in place at your local makerspace.",Makerspaces; Public libraries; Mapping,2022,Tegan Emes; Adrienne Orr,Western University,"London, Ontario, Canada",43.01017765,-81.27362631,eng,https://github.com/lis9704,CB-GH,Course; Mapping Project; Digital Scholarship Project,,true,image/jpeg,project,/objects/example0037.jpg,/objects/small/example0037_sm.jpg,"/objects/thumbs/example0037_th.jpg"
example0038,Objects of Empire,https://historianem.github.io/sample-repository-draft/,This collection of airline menus was created to help teach the course Objects of Empire. It is meant to serve as a sample for the development of future digital collections.,Airline menus; Airlines,2023,Emily Lyon,Northwestern University; Chabraja Center for Historical Studies,"Evanston, IL",42.06079276,-87.67664029,eng,https://github.com/historianem,CB-GH,Course,,,image/jpeg,project,/objects/example0038.jpg,/objects/small/example0038_sm.jpg,"/objects/thumbs/example0038_th.jpg"
example0039,Tracing Welty,https://pickawm.github.io/tracing/,"This collection explores Eudora Welty's connections to the Natchez Trace. Between 1940 and 1943, Welty set several stories and a novella along the Natchez Trace. She also wrote about this historic roadway in her 1944 essay, 'Some Notes on River Country.' Taking a cue from Digital Yoknapatawpha and like projects, Tracing Welty maps Welty's references to the Trace and uses historical materials to place them in different interpretive contexts.",Literature; Eudora Welty; Mapping,2022,Michael Pickard Syner; Patricia Seraiah Lodge,Millsaps College,"Jackson, MS",32.32255579,-90.17799943,eng,https://github.com/pickawm,CB-GH,Digital Archive; Mapping Project,,true,image/jpeg,project,/objects/example0039.jpg,/objects/small/example0039_sm.jpg,"/objects/thumbs/example0039_th.jpg"
example0040,puzzleswap,https://aeppers1.github.io/puzzleswap/,"Puzzleswap includes image files of 21 puzzles, either in boxes or completed, ready to swapped to new puzzlers. Most puzzles are created with recycled paper or cardboard, and they feature a range between 500 to 1,000 pieces.",Puzzles,2022,Amanda Epperson,,,,,eng,https://github.com/Aeppers1,CB-GH,Personal Collection,,,image/jpeg,project,/objects/example0040.jpg,/objects/small/example0040_sm.jpg,"/objects/thumbs/example0040_th.jpg"
example0041,Digital Videogame Art Scan Project,https://johaknigiu.github.io/Digital-Videogame-Art-Scan-Project/,"This project is a collection of box art, instruction manuals, cartridges, and discs from a personal video game collection. It features materials from the Sega Genesis, Sega Dreamcast, Nintendo GameCube, and Nintendo DS. Each game also features a link to YouTube videos that show trailers or examples of gameplay from particular titles and even the chance to play some titles through the Internet Archive’s use of web-based emulation. Created as part of the Z652 Digital Libraries course at Indiana University.",Video games; Video game art,2022,John Knight,Indiana University,"Bloomington, IN",39.1684777,-86.52301806,eng,https://github.com/JohaknigIU,CB-GH,Student Project,,,image/jpeg,project,/objects/example0041.jpg,/objects/small/example0041_sm.jpg,"/objects/thumbs/example0041_th.jpg"
example0042,To the Happy Couple,https://casemach.github.io/tothehappycouple/,A collection of materials from the bridal shower and wedding of Suzanne Stratman and Harry Machenheimer. Created as part of the Z652 Digital Libraries course at Indiana University.,Marriage; Wedding photographs; Wedding cards,2022,Casey Machenheimer,Indiana University,"Bloomington, IN",39.1684777,-86.52301806,eng,https://github.com/casemach,CB-GH,Student Project; Personal Collection,,,image/jpeg,project,/objects/example0042.jpg,/objects/small/example0042_sm.jpg,"/objects/thumbs/example0042_th.jpg"
example0043,Knit Stitch Library,https://bfmalone.github.io/knitstitchlibrary/,"The Knit Stitch Library is a collection for knitters interested in getting information on several different kinds of knitting stitches. It is a resource for everyone interested in knitting, whether they are just starting out or are more advanced and looking for inspiration. All stitches shown have detailed instructions, pattern abbreviations, difficulty ratings, ways to use this stitch, as well as information about the origin of the stitch if known. Created as part of the Z652 Digital Libraries course at Indiana University.",Knitting; Arts and crafts,2022,Brandis Malone,Indiana University,"Bloomington, IN",39.1684777,-86.52301806,eng,https://github.com/bfmalone,CB-GH,Student Project; Personal Collection,,,image/jpeg,project,/objects/example0043.jpg,/objects/small/example0043_sm.jpg,"/objects/thumbs/example0043_th.jpg"
example0044,Concert Programs of Pieces by Kathryn Edom,https://katmedom.github.io/concertprograms_draft/,A digital collection of programs for concerts featuring pieces composed by Kathryn Edom. Created as part of the Z652 Digital Libraries course at Indiana University.,Music; Concerts,2022,Kathryn Edom,Indiana University,"Bloomington, IN",39.1684777,-86.52301806,eng,https://github.com/KatMEdom,CB-GH,Student Project,,,image/jpeg,project,/objects/example0044.jpg,/objects/small/example0044_sm.jpg,"/objects/thumbs/example0044_th.jpg"
example0045,Status and the Sacred,https://alamorri.github.io/Status-and-the-Sacred/,This site is intended to serve as a resource for information about books of hours and certain information about Medieval Western European life associated with them. It is primarily designed to serve as a repository for scans of a book of hours in the collection of the Lilly Library at Indiana University Bloomington.,Religion; Medieval texts; Medieval Europe,2022,Alan Morris,Indiana University,"Bloomington, IN",39.1684777,-86.52301806,eng,https://github.com/alamorri,CB-GH,Student Project,Academic Library,,image/jpeg,project,/objects/example0045.jpg,/objects/small/example0045_sm.jpg,"/objects/thumbs/example0045_th.jpg"
example0046,The Art of Tarot,https://jwparkinson.github.io/tarotlibrary/,"This is a digital image collection sampling cards from multiple Tarot decks. The purpose of this collection is to show how different artists, separated by time, gender, and culture, each interprets the centuries-old format of Tarot. Created as part of the Z652 Digital Libraries course at Indiana University.",Tarot; Art; Spiritualism,2022,Julia Parkinson,Indiana University,"Bloomington, IN",39.1684777,-86.52301806,eng,https://github.com/jwparkinson,CB-GH,Student Project,,,image/jpeg,project,/objects/example0046.jpg,/objects/small/example0046_sm.jpg,"/objects/thumbs/example0046_th.jpg"
example0047,Reed Cats,https://reedkay.github.io/reedcats/,"The two cats of the house of Reed, Lulu and Pan and all their activities. Created as part of a class on on GitHub and Git.",Cats; Pets,2022,Kayla Reed,,,,,eng,https://github.com/reedkay,CB-GH,Student Project; Personal Collection,,,image/jpeg,project,/objects/example0047.jpg,/objects/small/example0047_sm.jpg,"/objects/thumbs/example0047_th.jpg"
example0048,Clement Wragge: A Selection of Items from Trove,https://wragge.github.io/trove-wragge-list-demo/,This exhibition was generated from a Trove List by the GLAM Workbench. The notebook converts Trove lists into a series of files that can be uploaded to a CollectionBuilder-GH repository to create an instant exhibition.,Meteorology; Meteorologist,2022,Tim Sherratt,,"Canberra, Australia",-35.23738849,149.0839671,eng,https://github.com/wragge,CB-GH,Digital Archive,,,image/jpeg,project,/objects/example0048.jpg,/objects/small/example0048_sm.jpg,"/objects/thumbs/example0048_th.jpg"
example0049,Coins of the Cairo Geniza,https://geniza.github.io/paleographicalglossary/,"This is a digital paleographical glossary for dating textual fragments. This resource can assist researchers in dating geniza fragments that do not explicitly mention years of recording but instead retain numismatic data. In many instances, the production history of coinage can aid us in estimating the earliest year in which a text may have been recorded.",Coins; Palaeography,2023,Matthew Dudley; Alan Elbaum,Princeton University; Geniza Lab,"Princeton, NJ",40.34985397,-74.63688688,eng,https://github.com/geniza,CB-GH,Digital Archive; Digital Scholarship Project,,,image/jpeg,project,/objects/example0049.jpg,/objects/small/example0049_sm.jpg,"/objects/thumbs/example0049_th.jpg"
example0050,Mapping Lifta,https://writingafterthedisaster.github.io/lifta/,This project documents the remnants of Palestinian Lifta.,Lifta; Palestine,2022,Jeff O'Brien,"University of California, Santa Barbara","Santa Barbara, CA",34.41474179,-119.8445267,eng,https://github.com/writingafterthedisaster,CB-GH,Digital Archive,,,image/jpeg,project,/objects/example0050.jpg,/objects/small/example0050_sm.jpg,"/objects/thumbs/example0050_th.jpg"
example0051,Chocolates Juncosa,https://laurenpv85.github.io/Unexpected-Collections/,Collection of 36 chromo trade cards produced by Spanish company Chocolates E. Juncosa. The cards depict the Cuban War of Independence (1895-1898) and the beginning of the Spanish-American War.,Cigar labels; Chromo trade cards; Cuban War of Independence,2023,Lauren Peña,The University of Texas at Austin,"Austin, TX",30.28528909,-97.73124575,eng,https://github.com/laurenpv85,CB-GH,Digital Archive,,,image/jpeg,project,/objects/example0051.jpg,/objects/small/example0051_sm.jpg,"/objects/thumbs/example0051_th.jpg"
example0052,Charley Harper and the National Park Service,https://jlhootman.github.io/harper-nps-posters/,This image gallery presents a portion of Harper’s commissioned work by the U.S. National Park Service and related maps. Prints of these works in poster format as well as the maps which relate to the geographic areas represented in Harper’s artwork are owned by the University of Kentucky Libraries and have been digitized by the UK Libraries’ Special Collections and Research Center.,Art; Posters; National Park Service,2021,Jennifer Hootman,University of Kentucky,"Lexington, KY",38.08783614,-84.49158298,eng,https://github.com/jlhootman,CB-GH,Digital Exhibit,Academic Library,,image/jpeg,project,/objects/example0052.jpg,/objects/small/example0052_sm.jpg,"/objects/thumbs/example0052_th.jpg"
example0053,Muskuy Yachay Archives,https://lwcarney.github.io/muskuyarchive/,"This collection contains materials related to Kichwa-language muskuy narratives of the Runa of Ecuador. It includes audiovisual, textual, and image files from the Lisa W. Carney's doctoral dissertation 'By the Authority of Dreams Truth and Knowledge in Kichwa Muskuy Narratives.'",Pottery; Indigenous knowledge,2021,Lisa W. Carney,University of Maryland,"College Park, MD",38.98731859,-76.94068748,eng,https://github.com/LWCarney,CB-GH,Digital Archive; Digital Scholarship Project,,,image/jpeg,project,/objects/example0053.jpg,/objects/small/example0053_sm.jpg,"/objects/thumbs/example0053_th.jpg"
example0054,Mineral and Rock Collection,https://ilewis13.github.io/Mineral-and-Rock-Collection/,This is a mineral and rock collection gathered from Travis Jackson's personal collection with a variety of specimens presented in their polished and rough forms.,Rocks; Minerals,2021,Irene Lewis,,,,,eng,https://github.com/ilewis13,CB-GH,Personal Collection,,,image/jpeg,project,/objects/example0054.jpg,/objects/small/example0054_sm.jpg,"/objects/thumbs/example0054_th.jpg"
example0055,The Boldest 19th Century Dare Devils,https://luanaamatuzio.github.io/The-Boldest-19th-Century-Dare-Devils/,"This is a digital collection of images detailing 19th century Dare Devils tightroping and barreling over the Falls. The three main individuals chosen are Annie Edson Taylor, Henry Bellini, and Charles Blondin. Created as part of the VISA 2P90: 19th Century Visual Culture course at Brock University.",Tightroping; Visual culture,2021,Luana Amatuzio,Brock University,"St. Catharines, Ontario, Canada",43.41983876,-79.25063695,eng,https://github.com/LuanaAmatuzio,CB-GH,Student Project,,,image/jpeg,project,/objects/example0055.jpg,/objects/small/example0055_sm.jpg,"/objects/thumbs/example0055_th.jpg"
example0056,Urban Family Recipe Collection,https://katiemik.github.io/urban-family-recipe-collection/,"This recipe collection began its life in a three-ring yellow binder which initially served as a way to preserve beloved family recipes for family members to reference and recreate. The Urban Family Recipe Collection is a digital repository that collects many of these recipes. Organized by a variety of means, including a recipe’s creator, main ingredient, seasonality of ingredients, cooking method, or meal type, there are many ways to locate a desired recipe. Once found, recipes can easily be printed or downloaded as a PDF for ease of reference or annotation. This collection will hopefully continue to grow as new recipes are developed.",Recipes; Family history,2021,Katie Mikulka,,,,,eng,https://github.com/katiemik,CB-GH,Personal Collection,,,image/jpeg,project,/objects/example0056.jpg,/objects/small/example0056_sm.jpg,"/objects/thumbs/example0056_th.jpg"
example0057,La Rana: PCTO Liceo Galvani e Università di Bologna,https://dersuchendee.github.io/trovalarana-liceogalvani/,"Il progetto intende attivare la ricerca, archiviazione, digitalizzazione, metadatazione e creazione di una Digital library del giornalino scolastico La Rana, pubblicato dal 1961 al 1968 e conservato parzialmente nell'Archivio Storico del Galvani, ma implementabile nella collezione completa con copie provenienti dalla Biblioteca Universitaria di Bologna e dall'Archivio della biblioteca stessa.",Newspapers,2023,Anna Sofia Lippolis,University of Bologna,"Bologna, Italy",44.49681054,11.33881603,ita,https://github.com/dersuchendee,CB-GH,Digital Archive,Academic Library,,image/jpeg,project,/objects/example0057.jpg,/objects/small/example0057_sm.jpg,"/objects/thumbs/example0057_th.jpg"
example0058,The Wonders of Ifugao,https://ckepino.github.io/the_wonders_of_ifugao/,"A collection of digital resources citing Ifugao culture. The Ifugao inhabit the most rugged mountainous part of the Philippines, high up in the central Cordillera in northern Luzon. The area refused to submit to numerous colonizers and thus preserve its rich cultural diversity.",Ifugao; Cultural diversity,2022,2X9 Group,,"Lagawe, Philippines",16.80468397,121.1758074,eng,https://github.com/ckepino,CB-GH,Digital Archive,,,image/jpeg,project,/objects/example0058.jpg,/objects/small/example0058_sm.jpg,"/objects/thumbs/example0058_th.jpg"
example0059,Sinapupunan: Celebrating the Best of Filipina Directors,https://flonnesan.github.io/Sinapupunan/,Sinapupunan is a digital exhibit compiling and celebrating the best films and documentaries of Filipina directors in the 21st century.,Film; Film directors,2022,Anton Campos; Dan Gabriel Castro; Nadine Coronel; Gail Daniel; Mark Andy Pedere,University of the Philippines,"Quezon City, Philippines",14.65375649,121.0683183,eng; tgl,https://github.com/flonnesan,CB-GH,Digital Archive,,,image/jpeg,project,/objects/example0059.jpg,/objects/small/example0059_sm.jpg,"/objects/thumbs/example0059_th.jpg"
example0060,UP LISSA Memoirs,https://khayeceeab.github.io/UPLISSAMemoirs/,"This collection aims to commemorate and promote University of the Philippines Library and Information Science Students Association (UP LISSA). With UP LISSA’s long and colorful history, let us all look back and celebrate UP LISSA’s events throughout the years, as well as its members’ accomplishments. Created as part of the CWTS 2 SLIS - Strengthening of a Barangay Library course at the University of the Philippines.",Student organizations; Library Science,2022,Khaye Cee A. Benedicto; Joseph Emmanuel S. Chan; Dominique De Guzman; Ralph Anthon Dela Torre; Rad Julongbayan,University of the Philippines,"Quezon City, Philippines",14.65375649,121.0683183,eng,https://github.com/khayeceeab,CB-GH,Digital Archive; Student Project,,,image/jpeg,project,/objects/example0060.jpg,/objects/small/example0060_sm.jpg,"/objects/thumbs/example0060_th.jpg"
example0061,Rizal Hall@100,https://curatory.tech/rizal_hall/,"This collection contains images of Rizal Hall at the University of the Philippines throughout history. Every academic year, hundreds of freshies climb up the historic stairs of Rizal Hall to attend their General Education (GE) subjects in the College of Arts and Sciences (CAS).",University history; University buildings,2021,Mary Dorothy dL. Jose; Paul Jason Perez,University of the Philippines,"Manila, Philippines",14.58404631,120.9845039,eng,,CB-CSV,Digital Archive,Academic Library,,image/jpeg,project,/objects/example0061.jpg,/objects/small/example0061_sm.jpg,"/objects/thumbs/example0061_th.jpg"
example0062,Gertzel Library,https://infoliterati.github.io/Gertzel_collection/,"This collection provides a broad overview of the published material from the library of the late Africanist scholar Prof. Cherry Gertzel (<a href=""http://cherrygertzel.net"" target=""_blank"">http://cherrygertzel.net</a>). It shows the subject areas, as well as the quantity and types, of published material in the Gertzel Library. The purpose of the collection is to make information about it more readily available in order to find a suitable home (or homes) for the material so that it can be used by Africanist scholars and researchers.",Africanist scholarship,2022,Karen Miller,Curtin University,"Bentley, Perth, Australia",-32.00470066,115.8918316,eng,https://github.com/infoliterati,CB-GH,Digital Archive,,,image/jpeg,project,/objects/example0062.jpg,/objects/small/example0062_sm.jpg,"/objects/thumbs/example0062_th.jpg"
example0063,Heaven and Earth,https://ahva-ubc.github.io/Heaven-and-Earth/,"This collection focuses on painting, sculpture, and graphic art in France, the Netherlands, Germany, and England in the 15th and 16th centuries, with special emphasis on the major figures of this period, from van Eyck and van der Weyden to Grunewald, Bosch, Durer, Holbein, and Pieter Bruegel. This site is meant to showcase content covered in the ARTH 323 Heaven and Earth: Renaissance Art and Culture in Northern Europe 1400-1600 course at the University of British Columbia.",Renaissance; European art; Art,2022,Joseph Monteyne; UBC AHVA Visual Resources Centre,University of British Columbia,"Vancouver, BC, Canada",49.26130538,-123.2461869,eng,https://github.com/ahva-vrc,CB-GH,Course,,,image/jpeg,project,/objects/example0063.jpg,/objects/small/example0063_sm.jpg,"/objects/thumbs/example0063_th.jpg"
example0064,And They Called It Vancouver,https://ubc-library-rbsc.github.io/langmann-2021/,"This digital exhibition features photographs and postcards from the Uno Langmann Family Collection of B.C. Photographs, housed at UBC's Rare Books and Special Collections.",Postcards; Local history; Family history,2021,Ashlynn Prasad,University of British Columbia,"Vancouver, BC, Canada",49.26130538,-123.2461869,eng,https://github.com/ubc-library-rbsc,CB-GH,Digital Archive,Academic Library,,image/jpeg,project,/objects/example0064.jpg,/objects/small/example0064_sm.jpg,"/objects/thumbs/example0064_th.jpg"
example0065,Middle East and North Africa Illustrated,https://gnmedatabase.github.io/site/,Middle East and North Africa Illustrated (MENAI) is an annually updated database of bibliographical information on all graphic novels that are related to the Middle Eastern and North African countries in various genres that are written in or translated into English. The MENAI is a side product of the HONORS 212 Near/Middle East Illustrated course at the University of Washington.,Graphic novels; Middle East; North Africa,2022,Selim S. Kuru; Andrew Weymouth,University of Washington,"Seattle, WA",47.65587864,-122.307394,eng,https://github.com/gnmedatabase,CB-GH,Digital Archive; Course,,,image/jpeg,project,/objects/example0065.jpg,/objects/small/example0065_sm.jpg,"/objects/thumbs/example0065_th.jpg"
example0066,Beaverhead Mine Documents,https://mbmg.mtech.edu/Information/Collections/Mine-Files/Beaverhead/,"This collection contains mining documents for properties and claims within Beaverhead County in southwest Montana. These documents include assays, correspondence, maps, news clippings, photos, publications, reports, surveys, or other material related to any property.",Mines; Montana; Maps; Mining documents,2021,Montana Bureau of Mines and Geology,Montana Bureau of Mines and Geology,"Butte, MT",46.00320747,-112.5285289,eng,,CB-CSV,Digital Archive,State Agency,true,image/jpeg,project,/objects/example0066.jpg,/objects/small/example0066_sm.jpg,"/objects/thumbs/example0066_th.jpg"
example0067,Lloyd C. Furer Cross Sections,http://mbmg.mtech.edu/Information/Collections/Furer/,"After 20 years in the oil industry, Lloyd Furer joined Indiana University and, among other research activities, taught surface geology for 10 years at the Indiana field station near Cardwell, Montana. Since retiring, Lloyd has spent decades correlating subsurface formations in the western U.S. based on his knowledge of surface geology and thousands of geophysical logs from Montana, Wyoming, Colorado, and the Dakotas. This collection of over 50 cross sections represents a portion of Lloyd Furer’s correlation work in Montana.",Geology; Montana; Geological cross-sections,2021,Montana Bureau of Mines and Geology,Montana Bureau of Mines and Geology,"Butte, MT",46.00320747,-112.5285289,eng,,CB-CSV,Digital Archive,State Agency,,image/jpeg,project,/objects/example0067.jpg,/objects/small/example0067_sm.jpg,"/objects/thumbs/example0067_th.jpg"
example0068,A Shaky Truce,https://shakytruce.github.io/,"This digital oral and public history project was a cooperative effort to showcase the unique history of Starkville, Mississippi’s civil rights struggles with particular emphasis on the local fight for school desegregation. This website is designed to tell a story of local activism and provide information for scholars and tools for teachers interested in exploring these local conversations about race, equality, and human rights.",Civil rights movements; Desegregation; Activism,2022,Deep South DH,Mississippi University for Women; University of Colorado,"Starkville, MS",33.45139402,-88.82055373,eng,https://github.com/shakytruce,CB-GH,Oral Histories; Digital Scholarship Project,,true,image/jpeg,project,/objects/example0068.jpg,/objects/small/example0068_sm.jpg,"/objects/thumbs/example0068_th.jpg"
