objectid,title,project_link,description,subject,date,creator,institution,location,latitude,longitude,language,creator_github,cb_template,collection_type,institution_type,home_feature,format,display_template,object_location,image_small,image_thumb
example0069,The Smith Papers Collection,https://smithpapers.github.io/,"The Smith Family Papers includes letters and diaries among family members and friends, with most letters from members of the Smith Family--Pauline and Sam H, and their children, Bernice, Christine, Martha, and “Sonny Boy.”",Letters; Diaries; Family history,2022,MUW Digital Studies,Mississippi University for Women,"Columbus, MS",33.49207836,-88.41882145,eng,https://github.com/smithpapers,CB-GH,Digital Archive,Academic Library,,image/jpeg,project,/objects/example0069.jpg,/objects/small/example0069_sm.jpg,"/objects/thumbs/example0069_th.jpg"
example0070,Postcards from the Global South,https://cpp-korea-mexico-postcards-project.github.io//global-south-postcards/,"Postcards from the Global South uses picture postcards to document colonial visual discourses on Mexico during the regime of Porfirio Díaz, and Korea during the first decades of the Japanese Occupation.",Korea--Japanese Occupation; Postcards,2022,Cal Poly Pomona,"California Polytechnic State University, Pomona","Pomona, CA",34.05634605,-117.8192415,eng,https://github.com/cpp-korea-mexico-postcards-project,CB-GH,Digital Archive,Academic Library,,image/jpeg,project,/objects/example0070.jpg,/objects/small/example0070_sm.jpg,"/objects/thumbs/example0070_th.jpg"
example0071,W.K. Kellogg Arabian Horse Library Postcard and Notecard Collection,https://cpplibrary.github.io/postcards-compound/,"The W.K. Kellogg Arabian Horse Library Postcard and Notecard Collection spans from the 1920s to the 1970s and contains both postcards and notecards with a connection to either the W.K. Kellogg Arabian Horse Ranch in Pomona, California or the Kellogg Company in Battle Creek, Michigan. The postcards mostly depict horses of the Kellogg Ranch but there are also scenic views of the property and Kellogg House, as well as various locations of the Kellogg Company.",Postcards; Horse ranches,2022,Cal Poly Pomona; W.K. Kellogg Arabian Horse Library,"California Polytechnic State University, Pomona","Pomona, CA",34.05634605,-117.8192415,eng,https://github.com/cpplibrary,CB-GH,Digital Archive,Academic Library,,image/jpeg,project,/objects/example0071.jpg,/objects/small/example0071_sm.jpg,"/objects/thumbs/example0071_th.jpg"
example0072,Colors of Ozu,https://drodz11.github.io/colors-of-ozu/,"This is an ongoing, film analysis and digital scholarship project examining the color films of Japanese filmmaker Yasujirō Ozu (1903-1963). The project leverages digital tools and technologies to novelly and creatively examine Ozu's final six films.",Color films; Film directors,2022,Dave Rodriguez,Florida State University,"Tallahassee, FL",30.44265478,-84.2983387,eng,https://github.com/drodz11,CB-GH,Digital Scholarship Project,,,image/jpeg,project,/objects/example0072.jpg,/objects/small/example0072_sm.jpg,"/objects/thumbs/example0072_th.jpg"
example0073,Performance and Exploitation,https://ncflib.github.io/BodiesMinds-Group2/,"This digital archive is comprised of people with dwarfism, as well as a few who had giantism. This project's purpose is to ask how the gaze, in its passing between staring and attention, can be interrogated to reveal the prejudices which still single out the anomalously bodied for the simple reason that they appear different from the normally bodied in their own ways of living.",Physical disabilities; Circuses; Performance art,2020,New College of Florida,New College of Florida,"Sarasota, FL",27.38587624,-82.56389533,eng,https://github.com/ncflib,CB-GH,Digital Archive; Digital Scholarship Project,,,image/jpeg,project,/objects/example0073.jpg,/objects/small/example0073_sm.jpg,"/objects/thumbs/example0073_th.jpg"
example0074,Beauty in Variation,https://ncflib.github.io/BodiesMinds-Group1/,"This collection examines ""beauty"" displayed in Ringling Circus's archives. A circus act tells us what bodies and visual traits were stigmatized and considered abnormal in the time and place of their performance. This allows us to draw conclusions about the definition of ""normal"" and about standards of beauty within the setting we're observing. In this collection, the visuals shown are forms of beauty modifications such as, but not limited to, clothing, accessories, extra limbs, and hair.",Beauty; Circuses,2020,New College of Florida,New College of Florida,"Sarasota, FL",27.38587624,-82.56389533,eng,https://github.com/ncflib,CB-GH,Digital Archive; Digital Scholarship Project,,,image/jpeg,project,/objects/example0074.jpg,/objects/small/example0074_sm.jpg,"/objects/thumbs/example0074_th.jpg"
example0075,Pain and Performace,https://ncflib.github.io/BodiesMinds-Group3/,"This collection is organized around core themes of pain and performance, as they are deployed across four categories common to circus ""freak shows"": swords and sword swallowing, needles and nails, extreme strength, and performers inflicting pain on another. In each case, the performers' ability to complete these feats inspires an awe that may override sympathy. While circus freak shows often featured performers and bodies that were visibly physically disabled, we call the subjects of this collection ""overly-abled,"" in order to highlight their difference but still call attention to the similar ways in which they are dehumanized.",Circuses; Pain,2020,New College of Florida,New College of Florida,"Sarasota, FL",27.38587624,-82.56389533,eng,https://github.com/ncflib,CB-GH,Digital Archive; Digital Scholarship Project,,,image/jpeg,project,/objects/example0075.jpg,/objects/small/example0075_sm.jpg,"/objects/thumbs/example0075_th.jpg"
example0076,Football in America,https://kwaldenphd.github.io/nd-archives/,"This site features select football-related collections from the University of Notre Dame Archives. Metadata was generated as part of Prof. Katherine Walden's F21 ""Football In America"" course.",Football,2022,Katherine Walden,University of Notre Dame,"Notre Dame, IN",41.7045786,-86.23537066,eng,https://github.com/kwaldenphd/,CB-GH,Digital Archive; Course,,,image/jpeg,project,/objects/example0076.jpg,/objects/small/example0076_sm.jpg,"/objects/thumbs/example0076_th.jpg"
example0077,Willett Family Photo Album,https://historycenter.mld.org/willett_album/,"The Willett family traveled from Bridgewater, Massachusetts to Meridian, Idaho in 1921 to visit their daughter. This photograph collection documents their six-week cross-country journey in an auto bungalow.",Local history; Scrapbooks; Idaho,2023,Meridian Library District History Center,Meridian Library District,"Meridian, ID",43.61313572,-116.3887168,eng,https://github.com/historycenter-mld,CB-CSV,Digital Archive,Public Library,,image/jpeg,project,/objects/example0077.jpg,/objects/small/example0077_sm.jpg,"/objects/thumbs/example0077_th.jpg"
example0078,Wyoming Oral History Online,http://oralhistory.wyshs.org/,"Wyoming is rich in oral history: an estimated 5,000 oral history interviews are archived in nearly 50 museums, libraries, and other institutions around the state. The Wyoming Oral History Online database (WOHO) contains more than 3500 oral histories from across Wyoming. The Wyoming State Historical Society created this database to make these materials easy for researchers to find.",Interviews; Wyoming,2022,Wyoming State Historical Society,Wyoming State Historical Society,"Wheatland, WY",42.05854396,-104.9525483,eng,,CB-GH,Oral Histories,Historical Society,,image/jpeg,project,/objects/example0078.jpg,/objects/small/example0078_sm.jpg,"/objects/thumbs/example0078_th.jpg"
example0079,We Exist Series 5,https://digitalprojects.usm.maine.edu/weexist5/,"We Exist is an ongoing six-part series looking at the history of Maine’s African American communities, curated by Dr. Lance Gibbs from the University of Southern Maine. This is the 5th installment, entitled ""Stories of African American Education and Employment in Maine,"" which examines where African Americans have learned and worked.",Maine; Local history; African Americans,2023,Paul Fuller; Lance Gibbs; Mary Holt,University of Southern Maine,"Portland, ME",43.662647,-70.27561321,eng,https://github.com/fullerpault,CB-GH,Digital Archive; Digital Scholarship Project,Academic Library,,image/jpeg,project,/objects/example0079.jpg,/objects/small/example0079_sm.jpg,"/objects/thumbs/example0079_th.jpg"
example0080,Storying Extinction,https://cdil.lib.uidaho.edu/storying-extinction/,Storying Extinction is a multidisciplinary digital humanities project that represents community response to the recent extirpation (2019) of southern mountain caribou from the South Selkirk mountains of North Idaho—the last caribou to inhabit the coterminous United States.,Extinction; Mapping; Caribou; Idaho,2020,"TheCDIL, Center for Digital Inquiry and Learning, University of Idaho Library","TheCDIL, Center for Digital Inquiry and Learning, University of Idaho Library","Moscow, ID",46.72904381,-117.0126472,eng,https://github.com/ctrlshifty,CB-CSV,Mapping Project; Digital Scholarship Project,Academic Library,true,image/jpeg,project,/objects/example0080.jpg,/objects/small/example0080_sm.jpg,"/objects/thumbs/example0080_th.jpg"
example0081,Modernizing the Landscape,https://madelineecollins.github.io/2p90project/,"This exhibition is a collection of images and texts that explore how Niagara's booming industry in the 19th century visually changed, collaborated with, or overwhelmed the landscape around it. The collection explores the visual culture of 19th century Niagara that displayed the relationship between factory and nature, and presented industry as an embedded, inexorable feature of Niagara’s environment. Created as part of the VISA 2P90: 19th Century Visual Culture course at Brock University.",Niagara Falls; Industrialization; Niagara Region,2021,Madeline Collins,Brock University,"St. Catharines, Ontario, Canada",43.41983876,-79.25063695,eng,https://github.com/MadelineECollins,CB-GH,Student Project,,,image/jpeg,project,/objects/example0081.jpg,/objects/small/example0081_sm.jpg,"/objects/thumbs/example0081_th.jpg"
example0082,Exploring the Influence of Wine in 19th Century Niagara,https://sp18al.github.io/Wine-Industry-In-19th-Century-Niagara/,"This collection displays resources sourced from the Brock Archives and Special Collections regarding wine and grape growing in the Niagara region from the 19th century. Placing these images within a larger context within the 19th century, we see the influx of new technology influencing the industrialization of the wine industry across the wide scale Niagara region in Ontario. Created as part of the VISA 2P90: 19th Century Visual Culture course at Brock University.",Niagara Falls; Wine; Niagara Region,2021,Sarah Puckett,Brock University,"St. Catharines, Ontario, Canada",43.41983876,-79.25063695,eng,https://github.com/sp18al,CB-GH,Student Project,,,image/jpeg,project,/objects/example0082.jpg,/objects/small/example0082_sm.jpg,"/objects/thumbs/example0082_th.jpg"
example0083,Hydroelectric Power at Niagara Falls,https://ellasexton.github.io/hydroelectric-falls/,An exhibition on the relationship of hydroelectricity with Niagara Falls. The images in this exhibition aim to tell the story of the construction of the Niagara Parks Power Station and how the infrastructure looks today. Created as part of the VISA 2P90: 19th Century Visual Culture course at Brock University.,Hydroelectric power; Niagara Falls; Niagara Region,2021,Ella Sexton,Brock University,"St. Catharines, Ontario, Canada",43.41983876,-79.25063695,eng,https://github.com/ellasexton,CB-GH,Student Project,,,image/jpeg,project,/objects/example0083.jpg,/objects/small/example0083_sm.jpg,"/objects/thumbs/example0083_th.jpg"
example0084,The Honeymoon Capital,https://mmclean6.github.io/honeymooncapital/,"Known as the Honeymoon Capital of the world, Niagara Falls is a city known for love, adventure, and thrill. The objects in this exhibit are all examples of love and romance in the  greater Niagara region or have some connection to the Niagara region. Created as part of the VISA 2P90: 19th Century Visual Culture course at Brock University.",Letters; Niagara Falls; Niagara Region,2021,Marley McLean,Brock University,"St. Catharines, Ontario, Canada",43.41983876,-79.25063695,eng,https://github.com/mmclean6,CB-GH,Student Project,,,image/jpeg,project,/objects/example0084.jpg,/objects/small/example0084_sm.jpg,"/objects/thumbs/example0084_th.jpg"
example0085,Don't Slip and Niagara Fall!,https://cuddycolbon.github.io/FINAL-EXHIBIT/,"A collection of images displaying the extreme winters of Niagara Falls and how its unique weather conditions create extraordinary natural phenomenons. By comparing images of the same scenery in Niagara Falls through the 19th century alone, we can see how the winter weather conditions can have such large impacts on certain parts of the natural landscape, as well as manmade structures. Created as part of the VISA 2P90: 19th Century Visual Culture course at Brock University.",Niagara Falls; Weather; Niagara Region,2021,Riley Cuddy-Colbon,Brock University,"St. Catharines, Ontario, Canada",43.41983876,-79.25063695,eng,https://github.com/cuddycolbon,CB-GH,Student Project,,,image/jpeg,project,/objects/example0085.jpg,/objects/small/example0085_sm.jpg,"/objects/thumbs/example0085_th.jpg"
example0086,A Fond Sigh of Friendship,https://abisarah.github.io/A-Fond-Sigh-of-Friendship/,"This collection features imagery and literature found in a 19th century Friendship Album, and a few from the 20th century.  These friendship albums provide insight into the history of Niagara and the types of people that lived there. Created as part of the VISA 2P90: 19th Century Visual Culture course at Brock University.",Friendship albums; Niagara Falls; Niagara Region,2021,Abigail Leeder,Brock University,"St. Catharines, Ontario, Canada",43.41983876,-79.25063695,eng,https://github.com/abisarah,CB-GH,Student Project,,,image/jpeg,project,/objects/example0086.jpg,/objects/small/example0086_sm.jpg,"/objects/thumbs/example0086_th.jpg"
example0087,The Tipped Inkwell,https://rs18bl.github.io/The-Tipped-Inkwell/,This collection provides a look at nineteenth century penmanship and how that relates to the century itself. Created as part of the VISA 2P90: 19th Century Visual Culture course at Brock University.,Penmanship; Niagara Region,2021,Rachel Stangl,Brock University,"St. Catharines, Ontario, Canada",43.41983876,-79.25063695,eng,https://github.com/rs18bl,CB-GH,Student Project,,,image/jpeg,project,/objects/example0087.jpg,/objects/small/example0087_sm.jpg,"/objects/thumbs/example0087_th.jpg"
example0088,Niagara in the 19th Century as Seen by George E. Curtis,https://jingyuez.github.io/history/,"The collection series focuses on the historical viewpoint of the United States' Niagara area, and it is credited to George E. Curtis, who was active from the 1860s until 1910 and was recognized for his stereoscopic views of Niagara Falls. Created as part of the VISA 2P90: 19th Century Visual Culture course at Brock University.",Stereoscopic views; Niagara Falls; Niagara Region,2021,Leyao Chen; Ke Shi; Yufei Wang; Jingyue Zhang,Brock University,"St. Catharines, Ontario, Canada",43.41983876,-79.25063695,eng,https://github.com/jingyuez,CB-GH,Student Project,,,image/jpeg,project,/objects/example0088.jpg,/objects/small/example0088_sm.jpg,"/objects/thumbs/example0088_th.jpg"
example0089,Souvenir Art in Niagara Falls,https://piipervaal.github.io/Souvenir-Art-in-Niagara-Falls/,"This digital exhibit focuses on tourism in Niagara during the late 19th century to mid 20th century, including the writing and souvenir art associated. Most of the artifacts presented were created by locals, advertising tourist attractions, andjournals kept by tourists and newsletters. Included are also poems, letters and photographs. Created as part of the VISA 2P90: 19th Century Visual Culture course at Brock University.",Advertisements; Niagara Falls; Niagara Region; Tourism,2021,Nikki Singh; Sara Fellman; Piper Valdock,Brock University,"St. Catharines, Ontario, Canada",43.41983876,-79.25063695,eng,https://github.com/piipervaal,CB-GH,Student Project,,,image/jpeg,project,/objects/example0089.jpg,/objects/small/example0089_sm.jpg,"/objects/thumbs/example0089_th.jpg"
example0090,Letters to St. Catharines,https://jessierichard.github.io/Letters-to-St.Catharines/,"This digital exhibition features a collection of handwritten letters from people to or from St. Catharines, Ontario. The grouping of letters displays a wide array of communication including words of love, letters from grandmothers for someone’s first birthday, and land ownership disputes. Created as part of the VISA 2P90: 19th Century Visual Culture course at Brock University.",Letters; Niagara Falls; Niagara Region,2021,Jessie Richard,Brock University,"St. Catharines, Ontario, Canada",43.41983876,-79.25063695,eng,https://github.com/jessierichard,CB-GH,Student Project,,,image/jpeg,project,/objects/example0090.jpg,/objects/small/example0090_sm.jpg,"/objects/thumbs/example0090_th.jpg"
example0091,Upper Steel Arch Bridge in Cyanotype,https://chris-tea1.github.io/Upper-Steel-Arch-Bridge-in-Cyanotype/,"The focus of this digital exhibit is a photobook of cyanotype prints of the Upper Steel Arch Bridge, taken by Charles W. Dill, who was the superintendent of the bridge from 1895-1899. The Upper Steel Arch Bridge, also known as “Honeymoon Bridge,” was the fourth bridge spanning the Niagara Gorge. Created as part of the VISA 2P90: 19th Century Visual Culture course at Brock University.",Cyanotype prints; Niagara Falls; Bridges; Niagara Region,2021,Christy Mitchell,Brock University,"St. Catharines, Ontario, Canada",43.41983876,-79.25063695,eng,https://github.com/chris-tea1,CB-GH,Student Project,,,image/jpeg,project,/objects/example0091.jpg,/objects/small/example0091_sm.jpg,"/objects/thumbs/example0091_th.jpg"
example0092,The Terrapin Tower in 19th Century Niagara,https://naomiegbunike.github.io/Terrapintowr/,"This collection of images explores the history of the destroyed 19th century Niagara Falls tourist site, The Terrapin Tower, and displays its impact on visual culture during the time of its existence. Created as part of the VISA 2P90: 19th Century Visual Culture course at Brock University.",Terrapin Tower; Niagara Falls; Niagara Region,2021,Naomi Egbunike,Brock University,"St. Catharines, Ontario, Canada",43.41983876,-79.25063695,eng,https://github.com/naomiegbunike,CB-GH,Student Project,,,image/jpeg,project,/objects/example0092.jpg,/objects/small/example0092_sm.jpg,"/objects/thumbs/example0092_th.jpg"
example0093,Niagara As Told Through Its Advertisements,https://connorhea.github.io/Niagararegionadvertisements/,The aim of this digital exhibition is to provide insight into the Niagara region by analyzing the intentions and depictions of companies through their advertisements during the 19th century. Created as part of the VISA 2P90: 19th Century Visual Culture course at Brock University.,Advertisements; Niagara Falls; Niagara Region,2021,Connor Old,Brock University,"St. Catharines, Ontario, Canada",43.41983876,-79.25063695,eng,https://github.com/connorhea,CB-GH,Student Project,,,image/jpeg,project,/objects/example0093.jpg,/objects/small/example0093_sm.jpg,"/objects/thumbs/example0093_th.jpg"
example0094,A Look at Healthcare in the Niagara Region in the Long 19th Century,https://ellabelle.github.io/19thCenturyHealthcareinNiagaraRegion/,This digital exhibition is a series of images that shows what healthcare looked like in the 19th century around the Niagara Region. Created as part of the VISA 2P90: 19th Century Visual Culture course at Brock University.,Niagara Region; Healthcare,2021,Ella Bos; Morgan Sarah Jane Branton,Brock University,"St. Catharines, Ontario, Canada",43.41983876,-79.25063695,eng,https://github.com/ellabelle,CB-GH,Student Project,,,image/jpeg,project,/objects/example0094.jpg,/objects/small/example0094_sm.jpg,"/objects/thumbs/example0094_th.jpg"
example0095,Pandemic Memories,https://claireschen.github.io/pandemic-demo/,"A digital collection pertaining to memories of the pandemic at home and at the University at Buffalo. This is an idiosyncratic set of images, documents, and clips to capture elements of the lock down and longer pandemic. The collection hints at the alternative ways of living and working during the initial stages of the pandemic and the gradual return to some kind of near normal. Created as part of CollectionBuilder course at the Digital Humanities Summer Institute (DHSI).",Pandemic; COVID-19,2022,Claire Schen,Digital Humanities Summer Institute (DHSI),"Buffalo, NY",42.88630335,-78.87783189,eng,https://github.com/claireschen,CB-GH,Personal Collection; Student Project,,,image/jpeg,project,/objects/example0095.jpg,/objects/small/example0095_sm.jpg,"/objects/thumbs/example0095_th.jpg"
example0096,Babylonian Elites,https://wangj619.github.io/babylonianelites,"This digital collection highlights the social networks of the elites in the city of Babylon during the reign of Darius I (522–486 BCE). Elite families passed down their family archives from generation to generation, some of which are preserved today. These archives consist of texts (contracts and court documents) concerning their properties, including its acquisition, management and transfer (such as inheritance divisions, dowry and gifting). Created as part of the CollectionBuilder course at the Digital Humanities Summer Institute (DHSI).",Babylon; Family archives,2022,Jinyan Wang,Digital Humanities Summer Institute (DHSI),,,,eng,https://github.com/wangj619,CB-GH,Digital Archive; Student Project,,,image/jpeg,project,/objects/example0096.jpg,/objects/small/example0096_sm.jpg,"/objects/thumbs/example0096_th.jpg"
example0097,Gullah Geechee Collection,https://spudmc10.github.io/gullahcollection,Collection of resources both available virtually and from personal data gathering concerning Gullah Geecheee. The current project seeks to gather contemporary expressions of Gullah Geechee together with historical representations to let visitors experience the language across time and space. Created as part of the CollectionBuilder course at the Digital Humanities Summer Institute (DHSI).,Interviews; Gullah Geecheee; African Americans,2022,Spud McCullough,Digital Humanities Summer Institute (DHSI),"Charleston, SC",32.77458197,-79.92584599,eng,https://github.com/spudmc10,CB-GH,Digital Archive; Student Project,,,image/jpeg,project,/objects/example0097.jpg,/objects/small/example0097_sm.jpg,"/objects/thumbs/example0097_th.jpg"
example0098,Recusant Readers,https://cchenovick.github.io/Recusant-Readers,"From the seventeenth through the eighteenth century, the Finch family of Mawdesley, Lancashire collected and left their marks in a library of devotional, homiletic, educational, polemical, and practical works. The Finch-Haydocke collection consists of roughly 250 printed books and several paper-bound manuscript notebooks collected or produced by the Finch family. Created as part of the CollectionBuilder course at the Digital Humanities Summer Institute (DHSI).",Manuscripts; School books,2022,Clarissa Chenovick,Digital Humanities Summer Institute (DHSI); Stonyhurst College Historic Libraries,"Stonyhurst, Clitheroe, United Kingdom",53.84750729,-2.471924885,eng,https://github.com/cchenovick,CB-GH,Digital Archive; Student Project,,,image/jpeg,project,/objects/example0098.jpg,/objects/small/example0098_sm.jpg,"/objects/thumbs/example0098_th.jpg"
example0099,UMW Buildings,https://ajksc.github.io/demo-collection,"A demo collection containing photographs of buildings at the University of Mary Washington in Fredericksburg, VA. Created as part of the CollectionBuilder course at the Digital Humanities Summer Institute (DHSI).",University buildings,2022,,Digital Humanities Summer Institute (DHSI),"Fredericksburg, VA",38.30212901,-77.47442708,eng,https://github.com/ajksc,CB-GH,Student Project,,,image/jpeg,project,/objects/example0099.jpg,/objects/small/example0099_sm.jpg,"/objects/thumbs/example0099_th.jpg"
example0100,Touring Antiquity: The Richard Stillwell Collection,https://jgearhart.github.io/stillwell,"Richard Stillwell (1899-1982), Princeton '21 and '24, was a beloved long-serving member of the faculty and a prolific scholar. More than 1200 photographic negatives taken early in his career belong to the Research Photographs collections of the Department of Art and Archaeology. Beginning in early 2019 Visual Resources staff (with much help from undergraduate student workers), captured, edited, and catalogued the collection. This digitization project has culminated in this online exhibition showcasing the many fine quality images of the collection, most of which were taken in Greece between 1924 and 1934 and many likely taken by his wife at the time, Agnes Newall. Created as part of the CollectionBuilder course at the Digital Humanities Summer Institute (DHSI).",Photographic negatives; Photographs,2022,Julia Gearhart,Digital Humanities Summer Institute (DHSI); Princeton University,"Princeton, NJ",40.34329043,-74.6550739,eng,https://github.com/jgearhart,CB-GH,Digital Archive; Student Project,,true,image/jpeg,project,/objects/example0100.jpg,/objects/small/example0100_sm.jpg,"/objects/thumbs/example0100_th.jpg"
